full_name,action_name,namespace,description,path_segment
ckan.logic.action.update.package_update,package_update,ckan.logic.action.update.,"Update a dataset (package). You must be authorized to edit the dataset and the groups that it belongs
to. It is recommended to call
ckan.logic.action.get.package_show(), make the desired changes to
the result, and then call package_update() with it. Plugins may change the parameters of this function depending on the value
of the dataset’s type attribute, see the
IDatasetForm plugin interface. For further parameters see
package_create().",/package_update
ckan.logic.action.update.package_resource_reorder,package_resource_reorder,ckan.logic.action.update.,"Reorder resources against datasets.  If only partial resource ids are
supplied then these are assumed to be first and the other resources will
stay in their original order",/package_resource_reorder
ckan.logic.action.update.package_relationship_update,package_relationship_update,ckan.logic.action.update.,"Update a relationship between two datasets (packages). The subject, object and type parameters are required to identify the
relationship. Only the comment can be updated. You must be authorized to edit both the subject and the object datasets.",/package_relationship_update
ckan.logic.action.update.group_update,group_update,ckan.logic.action.update.,"Update a group. You must be authorized to edit the group. Plugins may change the parameters of this function depending on the value
of the group’s type attribute, see the
IGroupForm plugin interface. For further parameters see
group_create().",/group_update
ckan.logic.action.update.organization_update,organization_update,ckan.logic.action.update.,"Update a organization. You must be authorized to edit the organization. For further parameters see
organization_create().",/organization_update
ckan.logic.action.update.user_update,user_update,ckan.logic.action.update.,"Update a user account. Normal users can only update their own user accounts. Sysadmins can update
any user account. For further parameters see
user_create().",/user_update
ckan.logic.action.update.user_generate_apikey,user_generate_apikey,ckan.logic.action.update.,Cycle a user’s API key,/user_generate_apikey
ckan.logic.action.update.task_status_update,task_status_update,ckan.logic.action.update.,Update a task status.,/task_status_update
ckan.logic.action.update.task_status_update_many,task_status_update_many,ckan.logic.action.update.,Update many task statuses at once.,/task_status_update_many
ckan.logic.action.update.term_translation_update,term_translation_update,ckan.logic.action.update.,Create or update a term translation. You must be a sysadmin to create or update term translations.,/term_translation_update
ckan.logic.action.update.term_translation_update_many,term_translation_update_many,ckan.logic.action.update.,Create or update many term translations at once.,/term_translation_update_many
ckan.logic.action.update.vocabulary_update,vocabulary_update,ckan.logic.action.update.,"Update a tag vocabulary. You must be a sysadmin to update vocabularies. For further parameters see
vocabulary_create().",/vocabulary_update
ckan.logic.action.update.dashboard_mark_activities_old,dashboard_mark_activities_old,ckan.logic.action.update.,"Mark all the authorized user’s new dashboard activities as old. This will reset
dashboard_new_activities_count() to 0.",/dashboard_mark_activities_old
ckan.logic.action.update.send_email_notifications,send_email_notifications,ckan.logic.action.update.,"Send any pending activity stream notification emails to users. You must provide a sysadmin’s API key in the Authorization header of the
request, or call this action from the command-line via a paster post ...
command.",/send_email_notifications
ckan.logic.action.update.package_owner_org_update,package_owner_org_update,ckan.logic.action.update.,Update the owning organization of a dataset,/package_owner_org_update
ckan.logic.action.update.bulk_update_private,bulk_update_private,ckan.logic.action.update.,Make a list of datasets private,/bulk_update_private
ckan.logic.action.update.bulk_update_public,bulk_update_public,ckan.logic.action.update.,Make a list of datasets public,/bulk_update_public
ckan.logic.action.update.bulk_update_delete,bulk_update_delete,ckan.logic.action.update.,Make a list of datasets deleted,/bulk_update_delete
ckan.logic.action.update.config_option_update,config_option_update,ckan.logic.action.update.,"Allows to modify some CKAN runtime-editable config options It takes arbitrary key, value pairs and checks the keys against the
config options update schema. If some of the provided keys are not present
in the schema a ValidationError is raised.
The values are then validated against the schema, and if validation is
passed, for each key, value config option: The following lists a key parameter, but this should be replaced by
whichever config options want to be updated, eg:",/config_option_update
ckan.logic.action.patch.package_patch,package_patch,ckan.logic.action.patch.,"Patch a dataset (package). The difference between the update and patch methods is that the patch will
perform an update of the provided parameters, while leaving all other
parameters unchanged, whereas the update methods deletes all parameters
not explicitly provided in the data_dict You must be authorized to edit the dataset and the groups that it belongs
to.",/package_patch
ckan.logic.action.patch.resource_patch,resource_patch,ckan.logic.action.patch.,"Patch a resource The difference between the update and patch methods is that the patch will
perform an update of the provided parameters, while leaving all other
parameters unchanged, whereas the update methods deletes all parameters
not explicitly provided in the data_dict",/resource_patch
ckan.logic.action.patch.group_patch,group_patch,ckan.logic.action.patch.,"Patch a group The difference between the update and patch methods is that the patch will
perform an update of the provided parameters, while leaving all other
parameters unchanged, whereas the update methods deletes all parameters
not explicitly provided in the data_dict",/group_patch
ckan.logic.action.patch.organization_patch,organization_patch,ckan.logic.action.patch.,"Patch an organization The difference between the update and patch methods is that the patch will
perform an update of the provided parameters, while leaving all other
parameters unchanged, whereas the update methods deletes all parameters
not explicitly provided in the data_dict",/organization_patch
ckan.logic.action.delete.user_delete,user_delete,ckan.logic.action.delete.,Delete a user. Only sysadmins can delete users.,/user_delete
ckan.logic.action.delete.package_delete,package_delete,ckan.logic.action.delete.,"Delete a dataset (package). This makes the dataset disappear from all web & API views, apart from the
trash. You must be authorized to delete the dataset.",/package_delete
ckan.logic.action.delete.dataset_purge,dataset_purge,ckan.logic.action.delete.,"Purge a dataset. Purging a database completely removes the dataset from the CKAN database,
whereas deleting a dataset simply marks the dataset as deleted (it will no
longer show up in the front-end, but is still in the db). You must be authorized to purge the dataset.",/dataset_purge
ckan.logic.action.delete.resource_delete,resource_delete,ckan.logic.action.delete.,Delete a resource from a dataset. You must be a sysadmin or the owner of the resource to delete it.,/resource_delete
ckan.logic.action.delete.resource_view_delete,resource_view_delete,ckan.logic.action.delete.,Delete a resource_view.,/resource_view_delete
ckan.logic.action.delete.resource_view_clear,resource_view_clear,ckan.logic.action.delete.,"Delete all resource views, or all of a particular type.",/resource_view_clear
ckan.logic.action.delete.package_relationship_delete,package_relationship_delete,ckan.logic.action.delete.,"Delete a dataset (package) relationship. You must be authorised to delete dataset relationships, and to edit both
the subject and the object datasets.",/package_relationship_delete
ckan.logic.action.delete.member_delete,member_delete,ckan.logic.action.delete.,"Remove an object (e.g. a user, dataset or group) from a group. You must be authorized to edit a group to remove objects from it.",/member_delete
ckan.logic.action.delete.group_delete,group_delete,ckan.logic.action.delete.,Delete a group. You must be authorized to delete the group.,/group_delete
ckan.logic.action.delete.organization_delete,organization_delete,ckan.logic.action.delete.,Delete an organization. You must be authorized to delete the organization.,/organization_delete
ckan.logic.action.delete.group_purge,group_purge,ckan.logic.action.delete.,"Purge a group. Purging a group completely removes the group from the CKAN database,
whereas deleting a group simply marks the group as deleted (it will no
longer show up in the frontend, but is still in the db). Datasets in the organization will remain, just not in the purged group. You must be authorized to purge the group.",/group_purge
ckan.logic.action.delete.organization_purge,organization_purge,ckan.logic.action.delete.,"Purge an organization. Purging an organization completely removes the organization from the CKAN
database, whereas deleting an organization simply marks the organization as
deleted (it will no longer show up in the frontend, but is still in the
db). Datasets owned by the organization will remain, just not in an
organization any more. You must be authorized to purge the organization.",/organization_purge
ckan.logic.action.delete.task_status_delete,task_status_delete,ckan.logic.action.delete.,Delete a task status. You must be a sysadmin to delete task statuses.,/task_status_delete
ckan.logic.action.delete.vocabulary_delete,vocabulary_delete,ckan.logic.action.delete.,Delete a tag vocabulary. You must be a sysadmin to delete vocabularies.,/vocabulary_delete
ckan.logic.action.delete.tag_delete,tag_delete,ckan.logic.action.delete.,Delete a tag. You must be a sysadmin to delete tags.,/tag_delete
ckan.logic.action.delete.unfollow_user,unfollow_user,ckan.logic.action.delete.,Stop following a user.,/unfollow_user
ckan.logic.action.delete.unfollow_dataset,unfollow_dataset,ckan.logic.action.delete.,Stop following a dataset.,/unfollow_dataset
ckan.logic.action.delete.group_member_delete,group_member_delete,ckan.logic.action.delete.,Remove a user from a group. You must be authorized to edit the group.,/group_member_delete
ckan.logic.action.delete.organization_member_delete,organization_member_delete,ckan.logic.action.delete.,Remove a user from an organization. You must be authorized to edit the organization.,/organization_member_delete
ckan.logic.action.delete.unfollow_group,unfollow_group,ckan.logic.action.delete.,Stop following a group.,/unfollow_group
ckan.logic.action.delete.job_clear,job_clear,ckan.logic.action.delete.,Clear background job queues. Does not affect jobs that are already being processed.,/job_clear
ckan.logic.action.delete.job_cancel,job_cancel,ckan.logic.action.delete.,Cancel a queued background job. Removes the job from the queue and deletes it.,/job_cancel